Rol,Caratulado,Fecha Sentencia,Materia,Submateria,Descriptores,Sala,Resultado Recurso,Tipo Recurso,Enlace Sentencia
Rol: 236-2022,Caratulado: COMUNIDAD MIRADOR SANTA ANITA CON SERVICIO DE EVALUACIÓN AMBIENTAL REGIÓN DE LOS LAGOS. (A),Fecha sentencia: 30-06-2023,Sistema de Evaluación de impacto ambiental (SEIA),Resolución de calificación ambiental (rca),"Reglas de la lógica, Sana crítica, Recurso de derecho estricto, Servicio de Evaluación Ambiental, Máximas de la experiencia, Resolución de Calificación Ambiental (RCA), Sistema de Evaluación de Impacto Ambiental (SEIA), Conocimientos científicamente afianzados, Estudio de impacto ambiental (EIA), Flujo vehicular, Sistemas de vida y costumbres de grupos humanos, Alegaciones contradictorias, Participación Ambiental Ciudadana (PAC), Reclamación en contra de una invalidación ambiental, Causa sobreviniente, Muestreo no probabilístico por bola de nieve o snow ball","Sala: TERCERA, CONSTITUCIONAL",Resultado recurso: RECHAZADAS CASACIÓN FORMA Y FONDO,Tipo recurso: (CIVIL) CASACIÓN AMBIENTAL,https://juris.pjud.cl/busqueda/u?c5lwv
Rol: 3363-2023,Caratulado: FREZ/SERVICIO DE EVALUACIÓN AMBIENTAL,Fecha sentencia: 20-06-2023,Admisibilidad del recurso de casación en el fondo,Resoluciones susceptibles de casación en el fondo,"Servicio de evaluación ambiental (SEA), Admisibilidad del recurso de casación en el fondo, Admisibilidad del recurso de casación en la forma, Naturaleza jurídica de la resolución impugnada, Reclamación de participación ciudadana en el SEIA, Segundo Tribunal Ambiental, Resoluciones susceptibles de casación en el fondo, Resoluciones susceptibles de casación en la forma","Sala: TERCERA, CONSTITUCIONAL",Resultado recurso: INADMISIBLES RECURSOS DE CASACIÓN FORMA Y FONDO,Tipo recurso: (CIVIL) CASACIÓN AMBIENTAL,https://juris.pjud.cl/busqueda/u?c5l4j
Rol: 3393-2023,Caratulado: EMPRESA DE TRANSPORTE FERROVIARIO S.A./SUBSECRETARIA MEDIO AMBIENTE,Fecha sentencia: 20-06-2023,Admisibilidad del recurso de casación en el fondo,Resoluciones susceptibles de casación en el fondo,"Admisibilidad del recurso de casación en el fondo, Subsecretaría del Medio Ambiente, Naturaleza jurídica de la resolución impugnada, Resoluciones susceptibles de casación en el fondo, Reconocimiento de calidad de humedal urbano, Procedencia del recurso de casación ambiental","Sala: TERCERA, CONSTITUCIONAL",Resultado recurso: INADMISIBLE CASACIÓN DE FONDO,Tipo recurso: (CIVIL) CASACIÓN AMBIENTAL,https://juris.pjud.cl/busqueda/u?c5l4k
Rol: 22343-2021,Caratulado: PEÑA GUZMAN CARLOS CON DIRECTOR EJECUTIVO DEL SERVICIO DE EVALUACIÓN AMBIENTAL (A),Fecha sentencia: 29-05-2023,Sistema de Evaluación de impacto ambiental (SEIA),Resolución de calificación ambiental (rca),"Resolución de Calificación Ambiental (RCA), Sistema de Evaluación de Impacto Ambiental (SEIA), Comité de Ministros, Revisión de la Resolución de calificación ambiental (RCA), Plan de acción, Sentencia de reemplazo, Infiltración del tranque de relaves, Plan de seguimiento y control de infiltraciones (psyci), área de no impacto","Sala: TERCERA, CONSTITUCIONAL",Resultado recurso: SENTENCIA DE REEMPLAZO,Tipo recurso: (CIVIL) CASACIÓN AMBIENTAL,https://juris.pjud.cl/busqueda/u?cufb4
Rol: 22343-2021,Caratulado: PEÑA GUZMAN CARLOS CON DIRECTOR EJECUTIVO DEL SERVICIO DE EVALUACIÓN AMBIENTAL (A),Fecha sentencia: 29-05-2023,Sistema de Evaluación de impacto ambiental (SEIA),Resolución de calificación ambiental (rca),"Derecho a vivir en un medio ambiente libre de contaminación, Resolución de Calificación Ambiental (RCA), Sistema de Evaluación de Impacto Ambiental (SEIA), Comité de Ministros, Amicus curiae, Norma Chilena 409/1, Codelco división andina, Proceso de revisión extraordinario, Infiltración del tranque de relaves, Revisión de resolución de calificación ambiental (rca), Plan de seguimiento y control de infiltraciones (psyci), Norma chilena para agua potable, área de no impacto","Sala: TERCERA, CONSTITUCIONAL","Resultado recurso: ACOGIDA CASACIÓN FONDO, ANULADA SENTENCIA",Tipo recurso: (CIVIL) CASACIÓN AMBIENTAL,https://juris.pjud.cl/busqueda/u?cud2t
Rol: 1085-2022,Caratulado: DONOSO CON SERVICIO DE EVALUACIÓN AMBIENTAL REGIÓN DE LOS LAGOS,Fecha sentencia: 01-03-2023,Sistema de Evaluación de impacto ambiental (SEIA),Resolución de calificación ambiental (rca),"Considerandos contradictorios, Estudio de sombras, Resolución de Calificación Ambiental (RCA), Sistema de Evaluación de Impacto Ambiental (SEIA), No se denuncia infracción a las normas reguladoras de la prueba, Proyecto inmobiliario, Adenda, Razonamientos incompatibles, Recurso no explica de que modo se produce la infracción, Falta de consideraciones de hecho o de derecho que sirven de fundamento a la sentencia, Recurso construido contra los hechos del proceso, Vicio influye sustancialmente en lo dispositivo, Luminosidad, Reclamación del artículo 17 n° 6 de la ley 20.600","Sala: TERCERA, CONSTITUCIONAL","Resultado recurso: RECHAZA CASACION EN EL FONDO, ACOGE CASACION EN LA FORMA",Tipo recurso: (CIVIL) CASACIÓN AMBIENTAL,https://juris.pjud.cl/busqueda/u?b6une
Rol: 1085-2022,Caratulado: DONOSO CON SERVICIO DE EVALUACIÓN AMBIENTAL REGIÓN DE LOS LAGOS,Fecha sentencia: 01-03-2023,Sistema de Evaluación de impacto ambiental (SEIA),Resolución de calificación ambiental (rca),"Recurso de casación en la forma, Examen de admisibilidad del recurso de casación en la forma, Inadmisibilidad del recurso de casación en la forma, Motivo del recurso de casación en la forma, Resolución de Calificación Ambiental (RCA), Sistema de Evaluación de Impacto Ambiental (SEIA), Corte carece de competencia, Causal de casación en la forma improcedente, Requisitos del recurso de casación en la forma, Proyecto inmobiliario, Negativa apertura proceso participación ciudadana, Requisitos de admisibilidad de recurso de casación en la forma, Reclamación del artículo 17 n° 6 de la ley 20.600, Resolución que declara inadmisible reclamación ambiental","Sala: TERCERA, CONSTITUCIONAL",Resultado recurso: SENTENCIA DE REEMPLAZO,Tipo recurso: (CIVIL) CASACIÓN AMBIENTAL,https://juris.pjud.cl/busqueda/u?b6um0
Rol: 170249-2022,Caratulado: INMOBILIARIA DE DEPORTES LA DEHESA S.A. (SEGUNDO TRIBUNAL AMBIENTAL),Fecha sentencia: 14-02-2023,Admisibilidad del recurso de queja,Falta o abuso grave,"Recurso de reclamación, Facultades disciplinarias, Falta o abuso grave, Rechazo del recurso de queja","Sala: TERCERA, CONSTITUCIONAL",Resultado recurso: RECHAZADO RECURSO DE QUEJA,Tipo recurso: (CIVIL) QUEJA,https://juris.pjud.cl/busqueda/u?ce6b0
Rol: 160112-2022,Caratulado: COOKE AQUACULTURE CHILE S.A. (HUNTER),Fecha sentencia: 03-02-2023,Potestad sancionadora y fiscalizadora,Medidas provisionales,"Medidas provisionales, Falta o abuso grave, Reclamación en contra de una resolución de la SMA, Potestad sancionadora y fiscalizadora, Juez inhabilitado, Causal legal de implicancia, Haber el juez manifestado de cualquier modo su dictamen sobre la cuestión pendiente, Independencia e imparcialidad de los jueces","Sala: TERCERA, CONSTITUCIONAL",Resultado recurso: ACOGIDO RECURSO DE QUEJA,Tipo recurso: (CIVIL) QUEJA,https://juris.pjud.cl/busqueda/u?co8bt
Rol: 5374-2021,Caratulado: RENDÓN CON DIRECTOR EJECUTIVO DEL SERVICIO DE EVALUACIÓN AMBIENTAL (A),Fecha sentencia: 27-01-2023,Daño ambiental,Existencia del daño,"Declaración de impacto ambiental, Recurso de reclamación, Servicio de Evaluación Ambiental, Daño ambiental, Emisión de ruidos molestos, Impacto ambiental, Proyecto inmobiliario, Artículo 17 n°8 de la ley 20.600, Emisión de ruidos, Estudio de impacto ambiental (EIA), Riesgo para la salud de la población aledaña, Segundo Tribunal Ambiental, Existencia del daño ambiental, Sistema de Evaluación Ambiental, Parque cousiño macul","Sala: TERCERA, CONSTITUCIONAL",Resultado recurso: SENTENCIA DE REEMPLAZO,Tipo recurso: (CIVIL) CASACIÓN AMBIENTAL,https://juris.pjud.cl/busqueda/u?b36qp
Rol: 5374-2021,Caratulado: RENDÓN CON DIRECTOR EJECUTIVO DEL SERVICIO DE EVALUACIÓN AMBIENTAL (A),Fecha sentencia: 27-01-2023,Daño ambiental,Existencia del daño,"Declaración de impacto ambiental, Recurso de reclamación, Uso habitacional, Plan de descontaminación, Daño ambiental, Emisión de ruidos molestos, Impacto ambiental, Proyecto inmobiliario, Artículo 17 n°8 de la ley 20.600, Comisión de Evaluación Ambiental de la Región Metropolitana, Emisión de ruidos, Estudio de impacto ambiental (EIA), Riesgo para la salud de la población aledaña, Segundo Tribunal Ambiental, Plan Regulador Comunal de Peñalolén, Niveles máximos de ruidos, Existencia de daño, Parque cousiño macul","Sala: TERCERA, CONSTITUCIONAL","Resultado recurso: ACOGIDA CASACIÓN FONDO, ANULADA SENTENCIA",Tipo recurso: (CIVIL) CASACIÓN AMBIENTAL,https://juris.pjud.cl/busqueda/u?b36q5
Rol: 92081-2021,Caratulado: BRUCHER VALENZUELA HERNAN CON YEVILAO YEVILAO MERCEDES*,Fecha sentencia: 13-01-2023,Sistema de Evaluación de impacto ambiental (SEIA),Participación ciudadana/consulta indígena,"Principio de congruencia, Servicio de Evaluación Ambiental, Sistema de Evaluación de Impacto Ambiental (SEIA), Pueblos originarios, Vicio de ultrapetita, Comisión de Evaluación Ambiental de la Región del Biobío, Estudio de impacto ambiental (EIA), Tercer Tribunal Ambiental, Efecto adverso significativo, Terminal marítimo GNL, Proceso de Consulta Indígena (PCI), Recursos bentónicos, Proceso de evaluación ambiental, Grupos humanos pertenecientes a los pueblos indígenas (ghppi), Impactos significativos sobre recursos naturales renovables","Sala: TERCERA, CONSTITUCIONAL",Resultado recurso: RECHAZADAS CASACIÓN FORMA Y FONDO,Tipo recurso: (CIVIL) CASACIÓN AMBIENTAL,https://juris.pjud.cl/busqueda/u?co64x
Rol: 91622-2021,Caratulado: BRUCHER VALENZUELA HERNAN CON ASOCIACION GREMIAL CAMARA DE COMERCIO DE PENCO *,Fecha sentencia: 13-01-2023,Sistema de Evaluación de impacto ambiental (SEIA),Estudio de impacto ambiental (eia),"Principio preventivo, Principio precautorio, Sistema de Evaluación de Impacto Ambiental (SEIA), Examen de legalidad, Área de influencia, Conocimientos científicamente afianzados, Emisiones atmosféricas, Estudio de impacto ambiental (EIA), Humedal, Medio humano, Paisaje, Participación ciudadana, Ruidos, Tercero independiente, Zona de nidificación, Efecto sinérgico, Medio marino, Principio participativo, Falta de antecedentes determinantes, Reclamación del artículo 17 n° 6 de la ley 20.600, Modalidad casa abierta, Fauna nativa, Guía de evaluación ambiental para fauna silvestre del servicio agrícola y ganadero, Calificación de especie vulnerable, Hincado de pilotes","Sala: TERCERA, CONSTITUCIONAL",Resultado recurso: RECHAZADAS CASACIÓN FORMA Y FONDO,Tipo recurso: (CIVIL) CASACIÓN AMBIENTAL,https://juris.pjud.cl/busqueda/u?co6n6
Rol: 137571-2022,Caratulado: ARANCIBIA/LÓPEZ,Fecha sentencia: 12-01-2023,Admisibilidad del recurso de queja,Resoluciones susceptibles de recurso de queja,"Tercero coadyuvante, Ministerio del Medio Ambiente (MMA), Ilustre Municipalidad de Quilicura, Interés del tercero, Improcedencia del recurso de queja, Actos trámites no son impugnables, Segundo Tribunal Ambiental, Falta de interés actual, Resolución que ordena retrotraer procedimiento, Ausencia de acto terminal, Procedimiento administrativo pendiente, Reconocimiento de calidad de humedal urbano","Sala: TERCERA, CONSTITUCIONAL",Resultado recurso: INADMISIBLE RECURSO DE QUEJA,Tipo recurso: (CIVIL) QUEJA,https://juris.pjud.cl/busqueda/u?co724
Rol: 137572-2022,Caratulado: INVERSIONES BUTAMALAL S.A. / MINISTERIO DEL MEDIO AMBIENTE,Fecha sentencia: 12-01-2023,Admisibilidad del recurso de queja,Resoluciones susceptibles de recurso de queja,"Ministerio del Medio Ambiente (MMA), Ilustre Municipalidad de Quilicura, Resoluciones susceptibles de recurso de queja, Actos trámites no son impugnables, Segundo Tribunal Ambiental, Resolución que ordena retrotraer procedimiento, Ausencia de acto terminal, Procedimiento administrativo pendiente, Reconocimiento de calidad de humedal urbano","Sala: TERCERA, CONSTITUCIONAL",Resultado recurso: INADMISIBLE RECURSO DE QUEJA,Tipo recurso: (CIVIL) QUEJA,https://juris.pjud.cl/busqueda/u?co726
Rol: 91629-2021,Caratulado: INVERSIONES GNL TALCAHUANO SPA CON ASOCIACION GREMIAL CAMARA DE COMERCIO DE PENCO *,Fecha sentencia: 11-01-2023,Sistema de Evaluación de impacto ambiental (SEIA),Invalidación,"Derecho a vivir en un medio ambiente libre de contaminación, Derechos adquiridos, Principio de conservación, Principio de trascendencia, Principio preventivo, Ultra petita, Principio de confianza legítima, Principio de la buena fe, Principio de seguridad jurídica, Silencio positivo, Invalidación del acto administrativo, Argumentos no configuran la causal invocada, Petición subsidiaria, Principio precautorio, Sistema de Evaluación de Impacto Ambiental (SEIA), Área de influencia, Participación ciudadana, Tercero independiente, Supletoriedad de la ley de bases de los procedimientos administrativos, Reclamación en contra de una invalidación ambiental, Invalidación, Decaimiento administrativo, Modalidad casa abierta","Sala: TERCERA, CONSTITUCIONAL",Resultado recurso: RECHAZADAS CASACIÓN FORMA Y FONDO,Tipo recurso: (CIVIL) CASACIÓN AMBIENTAL,https://juris.pjud.cl/busqueda/u?b2rpx
Rol: 10964-2022,Caratulado: INVERSIONES FK LIMITADA (TERCER TRIBUNAL AMBIENTAL DE VALDIVIA),Fecha sentencia: 05-01-2023,Acto administrativo,Motivación,"Acto administrativo, Concejo municipal, Instrumento de planificación territorial, Recurso de reclamación, Plan regulador comunal, Ministerio del Medio Ambiente (MMA), Medida para mejor resolver, Motivación de los actos administrativos, Tribunal Ambiental, Ilustre Municipalidad de Puerto Varas, Humedal urbano, Ausencia de falta o abuso grave al dictar sentencia, Inspección personal del tribunal, Legalidad, Motivación, Reconocimiento de calidad de humedal urbano, Recurso de reclamación contra resolución que reconoce calidad de humedal urbano, Acuerdos adoptados por tribunales colegiados","Sala: TERCERA, CONSTITUCIONAL",Resultado recurso: RECHAZADO RECURSO DE QUEJA,Tipo recurso: (CIVIL) QUEJA,https://juris.pjud.cl/busqueda/u?b2sq3
Rol: 160774-2022,Caratulado: FISCO DE CHILE- C.D.E/SEGUNDO TRIBUNAL AMBIENTAL,Fecha sentencia: 29-12-2022,Admisibilidad del recurso de queja,Resoluciones susceptibles de recurso de queja,"Fisco de Chile, Recurso de reclamación, Admisibilidad del recurso de queja, Naturaleza jurídica de la resolución impugnada, Segundo Tribunal Ambiental, Resolución no pone término al juicio ni hace imposible su continuación, Resoluciones susceptibles del recurso de queja, Solicitud de inscripción de humedal","Sala: TERCERA, CONSTITUCIONAL",Resultado recurso: INADMISIBLE RECURSO DE QUEJA,Tipo recurso: (CIVIL) QUEJA,https://juris.pjud.cl/busqueda/u?b2z41
Rol: 66086-2021,Caratulado: SOCIEDAD AGRICOLA COMERCIAL E INDUSTRIAL URCELAY HERMANOS LIMITADA CON SUPERINTENDENCIA DEL MEDIO AMBIENTE. (A),Fecha sentencia: 29-12-2022,Potestad sancionadora y fiscalizadora,Multa,"Beneficio económico, Multa, Principio de reserva legal, Tipicidad, Derecho administrativo sancionador, Núcleo esencial de la conducta sancionada, Prinicipio de legalidad, Rebaja de multa, Resolución de Calificación Ambiental (RCA), Potestad punitiva del Estado, Reclamación en contra de una resolución de la SMA, Potestad sancionadora y fiscalizadora, Residuos industriales líquidos, Sentencia de reemplazo, Capacidad de pago","Sala: TERCERA, CONSTITUCIONAL",Resultado recurso: SENTENCIA DE REEMPLAZO,Tipo recurso: (CIVIL) CASACIÓN AMBIENTAL,https://juris.pjud.cl/busqueda/u?b2jlf
Rol: 66086-2021,Caratulado: SOCIEDAD AGRICOLA COMERCIAL E INDUSTRIAL URCELAY HERMANOS LIMITADA CON SUPERINTENDENCIA DEL MEDIO AMBIENTE. (A),Fecha sentencia: 29-12-2022,Potestad sancionadora y fiscalizadora,Multa,"Beneficio económico, Multa, Potestad sancionatoria, Facultad discrecional, Resolución de Calificación Ambiental (RCA), Falta de motivación, Elusión del Sistema de Evaluación de Impacto Ambiental, Reclamación en contra de una resolución de la SMA, Potestad sancionadora y fiscalizadora, Hechos establecidos por los jueces del fondo son inamovibles, Facultad de interpretar, Residuos industriales líquidos, Planta de tratamiento de residuos líquidos industriales, No se denuncia o verifica infracción a normas reguladoras de la prueba, Producción y elaboración de vinos","Sala: TERCERA, CONSTITUCIONAL","Resultado recurso: ACOGIDA CASACIÓN FONDO, ANULADA SENTENCIA",Tipo recurso: (CIVIL) CASACIÓN AMBIENTAL,https://juris.pjud.cl/busqueda/u?b2jgg
Rol: 14448-2022,Caratulado: SERVICIO DE EVALUACIÓN AMBIENTAL REGIÓN DEL BIO BIO/I. MUNICIPALIDAD DE PUCÓN,Fecha sentencia: 26-12-2022,Admisibilidad del recurso de casación en el fondo,Manifiesta falta de fundamentos,"Examen de admisibilidad del recurso de casación en el fondo, Inadmisibilidad del recurso de casación en la forma, Admisibilidad del recurso de casación en la forma, Ilustre Municipalidad de Pucón, Rechazo por manifiesta falta de fundamento, Argumentos no configuran la causal invocada, Tribunal Ambiental, Acción de reclamación, Revisión de la Resolución de calificación ambiental (RCA), Servicio de Evaluación Ambiental de la Región de La Araucanía, Consideraciones contradictorias, Ausencia de consideraciones de hecho y de derecho, No se denuncia o verifica infracción a normas reguladoras de la prueba","Sala: TERCERA, CONSTITUCIONAL","Resultado recurso: INADMISIBLE CASACIÓN FORMA RECHAZADA, CASACIÓN FONDO",Tipo recurso: (CIVIL) CASACIÓN AMBIENTAL,https://juris.pjud.cl/busqueda/u?b2i2t
Rol: 46932-2022,Caratulado: PRADO/SERVICIO DE EVALUACIÓN AMBIENTAL REGIÓN DEL BIO BIO,Fecha sentencia: 26-12-2022,"Resoluciones judiciales, actuaciones de Auxiliares de la Administración de Justicia, del Ministerio Público y otros",Resoluciones de tribunales de justicia,"Admisibilidad del recurso de queja, Tribunal Ambiental, Inadmisible, Modificación de medida cautelar","Sala: TERCERA, CONSTITUCIONAL",Resultado recurso: INADMISIBLE RECURSO DE QUEJA,Tipo recurso: (CIVIL) QUEJA,https://juris.pjud.cl/busqueda/u?b2z42
Rol: 56030-2021,Caratulado: ILUSTRE MUNICIPALIDAD DE BUIN CON SUPERINTENDENCIA DEL MEDIO AMBIENTE.,Fecha sentencia: 23-12-2022,Potestad sancionadora,Legalidad,"Potestad sancionadora, Principio de proporcionalidad, Importancia del daño causado, Ilustre Municipalidad de Buin, Emisión de ruidos, Norma de ruido, Niveles máximos de ruidos, Principio de no contradicción, Vulneración de los principios de la sana crítica, Superintendencia del Medio Ambiente, Reclamación de multa administrativa, Legalidad, Acoge recurso de casación en la forma","Sala: TERCERA, CONSTITUCIONAL","Resultado recurso: ACOGIDA CASACIÓN FORMA, ANULADA SENTENCIA",Tipo recurso: (CIVIL) CASACIÓN AMBIENTAL,https://juris.pjud.cl/busqueda/u?b2jgk
Rol: 56030-2021,Caratulado: ILUSTRE MUNICIPALIDAD DE BUIN CON SUPERINTENDENCIA DEL MEDIO AMBIENTE.,Fecha sentencia: 23-12-2022,Potestad sancionadora,Legalidad,"Potestad sancionadora, Importancia del daño causado, Ilustre Municipalidad de Buin, Emisión de ruidos, Norma de ruido, Niveles máximos de ruidos, Superintendencia del Medio Ambiente, Reclamación de multa administrativa, Legalidad, Riesgo o peligro inminente para la salud de la población","Sala: TERCERA, CONSTITUCIONAL",Resultado recurso: SENTENCIA DE REEMPLAZO,Tipo recurso: (CIVIL) CASACIÓN AMBIENTAL,https://juris.pjud.cl/busqueda/u?b2jgi
Rol: 24812-2020,Caratulado: CELULOSA ARAUCO Y CONSTITUCION S.A. CON SUPERINTENDENCIA DEL MEDIO AMBIENTE (A),Fecha sentencia: 13-12-2022,Potestad sancionadora y fiscalizadora,Multa,"Principio de congruencia, Ultra petita, Superintendencia del medio ambiente (sma), Delegación de facultades, Debido proceso administrativo sancionador, Sanción de multa, Intencionalidad en la comisión, Celulosa Arauco, Potestad sancionadora y fiscalizadora, Hechos establecidos por los jueces del fondo son inamovibles, Congruencia procesal, Carencia de influencia en lo dispositivo del fallo, Recurso construido contra los hechos del proceso, Apreciación de la prueba conforme a la sana crítica, No denuncia el quebrantamiento o desatención de concreta regla de la sana crítica","Sala: TERCERA, CONSTITUCIONAL",Resultado recurso: RECHAZADAS CASACIÓN FORMA Y FONDO,Tipo recurso: (CIVIL) CASACIÓN AMBIENTAL,https://juris.pjud.cl/busqueda/u?dfddd
Rol: 14568-2021,Caratulado: FUNDACIÓN ROMPIENTES CON SUPERINTENDENCIA DEL MEDIO AMBIENTE,Fecha sentencia: 25-11-2022,Sistema de Evaluación de impacto ambiental (SEIA),Ingreso al sistema de evaluación de impacto ambiental (seia),"Abastecimiento de agua potable, Evaluación ambiental estratégica, Superintendencia del medio ambiente (sma), Aplicación de multa, Reclamación, Daño ambiental, Resolución de Calificación Ambiental (RCA), Facultades de la superintendencia del medio ambiente, Ingreso al Sistema de Evaluación de Impacto Ambiental (SEIA), Evaluación Ambiental Estratégica (EAE), Agua subterránea, Componente ambiental afectado, Superintendencia de medio ambiente (sma), Humedal topocalma","Sala: TERCERA, CONSTITUCIONAL",Resultado recurso: SENTENCIA DE REEMPLAZO,Tipo recurso: (CIVIL) CASACIÓN AMBIENTAL,https://juris.pjud.cl/busqueda/u?b2rr5
Rol: 14568-2021,Caratulado: FUNDACIÓN ROMPIENTES CON SUPERINTENDENCIA DEL MEDIO AMBIENTE,Fecha sentencia: 25-11-2022,Sistema de Evaluación de impacto ambiental (SEIA),Ingreso al sistema de evaluación de impacto ambiental (seia),"Procedimiento administrativo sancionador, Abastecimiento de agua potable, Evaluación ambiental estratégica, Superintendencia del medio ambiente (sma), Inmobiliaria, Daño ambiental, Facultades de la superintendencia del medio ambiente, Planta de tratamiento de aguas, Evaluación Ambiental Estratégica (EAE), Agua subterránea, Componente ambiental afectado, Ingreso a Sistema de Evaluación de Impacto Ambiental (SEIA), Reclamación contra resolución administrativa, Superintendencia de medio ambiente (sma), Humedal topocalma","Sala: TERCERA, CONSTITUCIONAL",Resultado recurso: RECHAZADA CASACIÓN EN LA FORMA Y ACOGE CASACION FONDO,Tipo recurso: (CIVIL) CASACIÓN AMBIENTAL,https://juris.pjud.cl/busqueda/u?b2i8v
Rol: 93528-2021,Caratulado: VENTURA CON MINERA LOS PELAMBRES .,Fecha sentencia: 14-11-2022,Potestad sancionadora y fiscalizadora,Acciones de fiscalización,"Acto administrativo ilegal, Archivo de la denuncia, Omisión de fiscalización, Superintendencia del medio ambiente (sma), Principio de celeridad, Principio de economía procedimental, Falta de fundamentación del acto administrativo, Aprobación de proyecto de construcción, Afectación de caudal, Disminución de caudal, Reclamación en contra de una resolución de la SMA, Acciones de fiscalización, Estero Pupío, Sentencia de reemplazo, Obligación de fiscalización","Sala: TERCERA, CONSTITUCIONAL",Resultado recurso: SENTENCIA DE REEMPLAZO,Tipo recurso: (CIVIL) CASACIÓN AMBIENTAL,https://juris.pjud.cl/busqueda/u?b5kh7
Rol: 13923-2021,Caratulado: DIRECTOR EJECUTIVO DEL SERVICIO DE EVALUACIÓN AMBIENTAL CON GONZÁLEZ (A),Fecha sentencia: 14-11-2022,Sistema de Evaluación de impacto ambiental (SEIA),Participación ciudadana/consulta indígena,"Principio preventivo, Reglas de la sana crítica, Servicio de evaluación ambiental (SEA), Servicio Agrícola y Ganadero (SAG), Aves, Declaración de Impacto Ambiental (DIA), Ingreso al Sistema de Impacto Ambiental (SEIA), Reclamación de participación ciudadana en el SEIA, Tercer Tribunal Ambiental, Tercero Coadyuvante, Efecto sinérgico, Parque eólico, Fauna silvestre, Murciélagos, Infracción manifiesta de las normas sobre apreciación de la prueba","Sala: TERCERA, CONSTITUCIONAL",Resultado recurso: RECHAZADAS CASACIÓN FORMA Y FONDO,Tipo recurso: (CIVIL) CASACIÓN AMBIENTAL,https://juris.pjud.cl/busqueda/u?b5agn
Rol: 93528-2021,Caratulado: VENTURA CON MINERA LOS PELAMBRES .,Fecha sentencia: 14-11-2022,Potestad sancionadora y fiscalizadora,Acciones de fiscalización,"Archivo de la denuncia, Omisión de fiscalización, Superintendencia del medio ambiente (sma), Falta de fundamentación del acto administrativo, Deber de fiscalización, Afectación de caudal, Incumplimiento de resolución, Reclamación en contra de una resolución de la SMA, Acciones de fiscalización, Depósito de relaves, Estero Pupío, Minera Los Pelambres, Competencia superintendencia de medio ambiente (sma)","Sala: TERCERA, CONSTITUCIONAL","Resultado recurso: ACOGIDA CASACIÓN FONDO, ANULADA SENTENCIA",Tipo recurso: (CIVIL) CASACIÓN AMBIENTAL,https://juris.pjud.cl/busqueda/u?b49vn
Rol: 114682-2022,Caratulado: SERVICIO DE EVALUACIÓN AMBIENTAL REGIÓN DEL BIO BIO/RETAMAL,Fecha sentencia: 04-11-2022,Admisibilidad del recurso de queja,Resoluciones susceptibles de recurso de queja,"Recurso de reposición, Admisibilidad del recurso de queja, Servicio de Evaluación Ambiental, Resoluciones susceptibles del recurso de queja","Sala: TERCERA, CONSTITUCIONAL",Resultado recurso: INADMISIBLE RECURSO DE QUEJA,Tipo recurso: (CIVIL) QUEJA,https://juris.pjud.cl/busqueda/u?b49dv
