Rol,Caratulado,Fecha Sentencia,Materia,Submateria,Descriptores,Sala,Resultado Recurso,Tipo Recurso,Enlace Sentencia
Rol: 100805-2016,Caratulado: JOSE HORACIO CAYUN QUIROZ CON SERVICIO DE EVALUACION AMBIENTAL.,Fecha sentencia: 29-12-2017,Sistema de Evaluación de impacto ambiental (SEIA),Participación ciudadana/consulta indígena,"Competencia, Consulta indígena, Valoración de la prueba, Ultra petita, Comunidad indígena, Central Hidroeléctrica, Superintendencia del medio ambiente (sma), Falta de fundamentación, Resolución de Calificación Ambiental (RCA), Sistema de Evaluación de Impacto Ambiental (SEIA), Tribunal Ambiental, Principio de la razón suficiente, Comité de Ministros, Derecho ambiental, Citra petita, Artículo 17 n°6 de la ley 20.600, Artículo 29 de la ley 19.300, Convenio 169 de la Organización Internacional del Trabajo (OIT) sobre pueblos indígenas y tribales en países independientes, Director Ejecutivo del Servicio de Evaluación Ambiental (SEA), Estudio de impacto ambiental (EIA), Observaciones ciudadanas, Participación ciudadana, Reclamación de participación ciudadana en el SEIA, Comisión de Evaluación Ambiental de la Región de Los Lagos, Comunidad Domingo Cayún Panicheo, Empresa Mediterráneo S.A., Estudio antropológico, Lago tagua Tagua, Línea de transmisión eléctrica, Río Manso, Río Puelo, Río Torrentoso, Central de pasada","Sala: TERCERA, CONSTITUCIONAL",Resultado recurso: RECHAZADAS CASACIÓN FORMA Y FONDO (M),Tipo recurso: (CIVIL) CASACIÓN FORMA Y FONDO,https://juris.pjud.cl/busqueda/u?e6is
Rol: 18341-2017,Caratulado: SOCIEDAD AGRICOLA EL TRANQUE DE ANGOSTURA LIMITADA CON SUPERINTENDENCIA DEL MEDIO AMBIENTE,Fecha sentencia: 27-12-2017,Admisibilidad del recurso de casación en el fondo,Resoluciones susceptibles de casación en el fondo,"Acto terminal, Acto trámite, Procedimiento administrativo sancionador, Admisibilidad del recurso de casación en el fondo, Superintendencia del medio ambiente (sma), Admisibilidad del recurso de casación en la forma, Malos olores, Derecho ambiental, Comisión Regional del Medio Ambiente de la Región de O'Higgins, Reclamación en contra de la invalidación ambiental, Sanción y fiscalización, Procedimientos sancionatorio, Sociedad Agrícola El Tranque de Angostura Ltda., Resoluciones susceptibles de casación en el fondo, Resoluciones susceptibles de casación en la forma","Sala: TERCERA, CONSTITUCIONAL",Resultado recurso: INADMISIBLES RECURSOS DE CASACIÓN FORMA Y FONDO(M),Tipo recurso: (CIVIL) CASACIÓN FORMA Y FONDO,https://juris.pjud.cl/busqueda/u?dpel
Rol: 3682-2017,Caratulado: ECOMAULE SA CON SUPERINTENDECIA DEL MEDIO AMBIENTE,Fecha sentencia: 20-12-2017,Admisibilidad del recurso de casación en la forma,Causales recurso de casación en la forma,"Medidas provisionales, Programa de cumplimiento, Superintendencia del medio ambiente (sma), Admisibilidad del recurso de casación en la forma, Emisión de olores molestos, Tratamiento de aguas servidas, Acto administrativo de termino, Centro de Tratamiento de Residuos Ecomaule, Daño inminente al medio ambiente, Sanción y fiscalización, Segundo Tribunal Ambiental, Infracción a la sana crítica, Reclamo en contra de una resolución de la sma, Causales del recurso de casación en la forma","Sala: TERCERA, CONSTITUCIONAL",Resultado recurso: INADMISIBLE CASACIÓN FORMA (M),Tipo recurso: (CIVIL) CASACIÓN FORMA,https://juris.pjud.cl/busqueda/u?ex2g
Rol: 24838-2017,Caratulado: PROACTIVA SERVICIOS URBANOS S.A CON SERVICIO DE EVALUACION AMBIENTAL (A),Fecha sentencia: 14-12-2017,Sistema de Evaluación de impacto ambiental (SEIA),Comité de ministros,"Medidas de mitigación, Principio de proporcionalidad, Proporcionalidad de la medida, Test de proporcionalidad, Dirección de Vialidad del Ministerio de Obras Públicas, Secretaría Regional Ministerial de Obras Públicas, Deber de fundamentación, Sistema de Evaluación de Impacto Ambiental (SEIA), Comité de Ministros, Pirncipio de contrariedad, Derecho ambiental, Alteración de sistemas de vida y costumbres, Artículo 17 n°5 de la ley 20.600, Artículo 20 de la ley 19.300, Comisión de Evaluación Ambiental de la Región Metropolitana, Declaración de Impacto Ambiental (DIA), Director Ejecutivo del Servicio de Evaluación Ambiental (SEA), Estudio de impacto ambiental (EIA), Exigencias ambientales, Facultades de la administración, Informe Consolidado de Evaluación Ambiental (ICE), Reclamación del titular en el SEIA, Acceso vial, Condición ambiental, Conectividad vial, Conservación de caminos, Estándar vial, Estudio de ingeniería vial, Idoneidad de la medida, Impacto ambiental significativo, Necesidad de la medida, Proactiva Servicios Urbanos S.A., Proyecto Ajustes al Acceso Vial, Puente peatonal","Sala: TERCERA, CONSTITUCIONAL",Resultado recurso: RECHAZADAS CASACIÓN FORMA Y FONDO (M),Tipo recurso: (CIVIL) CASACIÓN FORMA Y FONDO,https://juris.pjud.cl/busqueda/u?gq62
Rol: 88948-2016,Caratulado: ANTOFAGASTA TERMINAL INTERNACIONAL S.A. CON SUPERINTENDENCIA DEL MEDIO AMBIENTE.,Fecha sentencia: 06-12-2017,Potestad sancionadora y fiscalizadora,Multa,"Intencionalidad, Multa, Programa de cumplimiento, Superintendencia del medio ambiente (sma), Acumulación de autos, Puerto de antofagasta, Derecho ambiental, Artículo 17 n°3 de la ley 20.600, Artículo 56 de la ley 20.417, Emisiones atmosféricas, Reclamación en contra de una resolución de la SMA, Sanción y fiscalización, Segundo Tribunal Ambiental, Antofagasta Terminal Internacional S.A., Hermeticidad, Limpieza zona urbana, Polvo fugitivo, Terminal de embarque de graneles minerales","Sala: TERCERA, CONSTITUCIONAL",Resultado recurso: SENTENCIA DE REEMPLAZO (M),Tipo recurso: (CIVIL) CASACIÓN FORMA Y FONDO,https://juris.pjud.cl/busqueda/u?f3eo
Rol: 88948-2016,Caratulado: ANTOFAGASTA TERMINAL INTERNACIONAL S.A. CON SUPERINTENDENCIA DEL MEDIO AMBIENTE.,Fecha sentencia: 06-12-2017,Potestad sancionadora y fiscalizadora,Multa,"Control judicial, Criterios de determinación de la sanción, Ius puniendi, Multa, Principio conclusivo, Principio de no formalización, Principio preventivo, Reclamo de ilegalidad, Sana crítica, Sanción administrativa, Sanción pecuniaria, Sumario administrativo, Valoración de la prueba, Superintendencia del medio ambiente (sma), Principio de economía procedimental, Derecho al debido proceso, Daño ambiental, Principio de servicialidad, Finalidad correctiva, Potestad sacionadora, Resolución de Calificación Ambiental (RCA), Antofagasta terminal internacional (ati) , Potestad expresa, Facultades de la superintendencia del medio ambiente, Identidad de los fundamentos de los cargos de los procedimientos administrativos","Sala: TERCERA, CONSTITUCIONAL","Resultado recurso: ACOGIDA CASACIÓN FONDO, ANULADA SENTENCIA DE (M)",Tipo recurso: (CIVIL) CASACIÓN FORMA Y FONDO,https://juris.pjud.cl/busqueda/u?f3ep
Rol: 31861-2017,Caratulado: JUNTA DE VIGILANCIA DE LA TERCERA SECCION DEL RIO MAPOCHO CON AGUAS ANDINAS,Fecha sentencia: 22-11-2017,Daño ambiental,Existencia del daño,"Junta de vigilancia, Daño ambiental, Planta de tratamiento de aguas servidas, Resolución de Calificación Ambiental (RCA), Falta de prueba, Derecho ambiental, Disminución caudal del acuífero, Existencia del daño, Existencia del daño ambiental, Riego, Suelo, Tercera Sección del Río Mapocho","Sala: TERCERA, CONSTITUCIONAL",Resultado recurso: RECHAZA CASACION EN EL FONDO (M),Tipo recurso: (CIVIL) CASACIÓN FONDO,https://juris.pjud.cl/busqueda/u?hvxm
Rol: 97792-2016,Caratulado: COMITE PRODEFENSA DEL PATRIMONIO HISTORICO CULTURAL DE VIÑA DEL MAR CONTRA RES N°1135-2015 DEL COMITE DE MINISTROS(SERVICIO DE EVALUACION AMBIENTAL.TERCERO COADYUVANTE: INMOBILIARIA PUNTA PIQUEROS S.A.),Fecha sentencia: 06-11-2017,Sistema de Evaluación de impacto ambiental (SEIA),Participación ciudadana/consulta indígena,"Normas reguladoras de la prueba, Principio de congruencia, Principio de participación ciudadana, Principio preventivo, Sana crítica, Valoración de la prueba, Ultra petita, Sistema de Evaluación de Impacto Ambiental (SEIA), Comité de Ministros, Derecho ambiental, Aclaraciones, rectificaciones o ampliaciones, Aplicación retroactiva, Área de influencia, Artículo 17 n°6 de la ley 20.600, Artículo 29 de la ley 19.300, Dunas, Estudio de impacto ambiental (EIA), Hotel Punta Piqueros, Inmobiliaria Punta, Modificación sustantiva del proyecto, Paisaje, Participación ciudadana, Peñón Oreja de Burro, Piqueros S.A., Proyecto Hotel Punta Piqueros, Reclamación de participación ciudadana en el SEIA, Riesgo por tsunami, Riesgo sísmico, Tribunal incompetente, Falta de consideraciones de hecho o de derecho que sirven de fundamento a la sentencia","Sala: TERCERA, CONSTITUCIONAL",Resultado recurso: RECHAZADAS CASACIÓN FORMA Y FONDO (M),Tipo recurso: (CIVIL) CASACIÓN FORMA Y FONDO,https://juris.pjud.cl/busqueda/u?c6ls
Rol: 36202-2017,Caratulado: CARRASCO MARTINEZ CATALINA / SUPERINTEBDENCIA DEL AMBIENTE,Fecha sentencia: 06-11-2017,Potestad sancionadora y fiscalizadora,Programa de cumplimiento,"Programa de cumplimiento, Superintendencia del medio ambiente (sma), Alegaciones nuevas, Derecho ambiental, Artículo 17 n°3 de la ley 20.600, Artículo 56 de la ley 20.417, Consorcio Santa Marta S.A., Minera la Florida Limitada, Reclamación en contra de una resolución de la SMA, Sanción y fiscalización, Segundo Tribunal Ambiental","Sala: TERCERA, CONSTITUCIONAL",Resultado recurso: RECHAZA CASACION EN EL FONDO (M),Tipo recurso: (CIVIL) CASACIÓN FONDO,https://juris.pjud.cl/busqueda/u?f3mf
Rol: 24422-2016,Caratulado: MUNICIPALIDAD DE TEMUCO CON SUPERINTENDENCIA DEL MEDIO AMBIENTE.,Fecha sentencia: 25-10-2017,Potestad sancionadora y fiscalizadora,Multa,"Multa, Non bis in ídem, Razonabilidad del acto administrativo, Criterios para determinar la sanción, Sanción debidamente fundamentada, Reclamación en contra de una resolución de la SMA, Potestad sancionadora y fiscalizadora, Acumulación de sanciones","Sala: TERCERA, CONSTITUCIONAL",Resultado recurso: RECHAZA CASACION EN EL FONDO (M),Tipo recurso: (CIVIL) CASACIÓN FORMA Y FONDO,https://juris.pjud.cl/busqueda/u?f3ne
Rol: 41790-2016,Caratulado: EMPRESA ELECTRICA CAMPICHE S.A. CON SUPERINTENDENCIA DEL MEDIO AMBIENTE.,Fecha sentencia: 07-08-2017,Acto administrativo,Publicidad/Notificación,"Ilegalidad, Interesado, Procedimiento sancionatorio, Transparencia, Superintendencia del medio ambiente (sma), Información pública, Información, AES GENER S.A., Ley de Transparencia, Derecho ambiental, Artículo 17 n°3 de la ley 20.600, Artículo 56 de la ley 20.417, Complejo Termoeléctrico Ventanas, Derechos del fiscalizado, Empresa Eléctrica Campiche S.A., Empresa Eléctrica Ventanas S.A., Expediente, Principios, Puchuncaví, Reclamación en contra de una resolución de la SMA, Reserva, Reserva de la información, Sanción y fiscalización, Segundo Tribunal Ambiental","Sala: TERCERA, CONSTITUCIONAL","Resultado recurso: ACOGIDA CASACIÓN FONDO, ANULADA SENTENCIA DE (M)",Tipo recurso: (CIVIL) CASACIÓN FORMA Y FONDO,https://juris.pjud.cl/busqueda/u?hy1o
Rol: 41790-2016,Caratulado: EMPRESA ELECTRICA CAMPICHE S.A. CON SUPERINTENDENCIA DEL MEDIO AMBIENTE.,Fecha sentencia: 07-08-2017,Procedimiento administrativo,Publicidad/Notificación,"Ilegalidad, Interesado, Procedimiento sancionatorio, Transparencia, Superintendencia del medio ambiente (sma), Información, AES GENER S.A., Ley de Transparencia, Derecho ambiental, Artículo 17 n°3 de la ley 20.600, Artículo 56 de la ley 20.417, Complejo Termoeléctrico Ventanas, Derechos del fiscalizado, Empresa Eléctrica Campiche S.A., Empresa Eléctrica Ventanas S.A., Principios, Puchuncaví, Reclamación en contra de una resolución de la SMA, Reserva de la información, Sanción y fiscalización, Segundo Tribunal Ambiental","Sala: TERCERA, CONSTITUCIONAL",Resultado recurso: SENTENCIA DE REEMPLAZO (M),Tipo recurso: (CIVIL) CASACIÓN FORMA Y FONDO,https://juris.pjud.cl/busqueda/u?hy1p
Rol: 38340-2016,Caratulado: EXPORTADORA LOS FIORDOS LTDA. CON SUPERINTENDENCIA DEL MEDIO AMBIENTE.,Fecha sentencia: 03-08-2017,Potestad sancionadora y fiscalizadora,Multa,"Principio preventivo, Multa por incumplimiento, Superintendencia del medio ambiente (sma), Decaimiento del procedimiento administrativo sancionador, Límite máximo permitido, Presunción de veracidad del acta de fiscalización, Principio precautorio, Sistema de Evaluación de Impacto Ambiental (SEIA), Centros de Engorda de Salmones (CES), Cultivo de salmones, Infracción Resolución de Calificación Ambiental, Inicio del procedimiento de fiscalización, Inicio del procedimiento sancionador, Organismos sectoriales, Reclamación en contra de una resolución de la SMA, Subprograma de fiscalización, Potestad sancionadora y fiscalizadora, Error jurídico de los sentenciadores influye en lo dispositivo del fallo, Actuación de ministro de fe, Servicio nacional de pesca y acuicultura (sernapesca), No denuncia el quebrantamiento o desatención de concreta regla de la sana crítica, Infracción manifiesta de las normas sobre apreciación de la prueba, Mal manejo de la mortalidad existente en centro de cultivo de peces","Sala: TERCERA, CONSTITUCIONAL","Resultado recurso: ACOGIDA CASACIÓN FONDO, ANULADA SENTENCIA DE (M)",Tipo recurso: (CIVIL) CASACIÓN FORMA Y FONDO,https://juris.pjud.cl/busqueda/u?dpem
Rol: 38340-2016,Caratulado: EXPORTADORA LOS FIORDOS LTDA. CON SUPERINTENDENCIA DEL MEDIO AMBIENTE.,Fecha sentencia: 03-08-2017,Potestad sancionadora y fiscalizadora,Multa,"Multa, Superintendencia del medio ambiente (sma), Medidas preventivas, Ministros de fe, Resolución de Calificación Ambiental (RCA), Servicio nacional de pesca (sernapesca), Derecho ambiental, Artículo 17 n°3 de la ley 20.600, Artículo 56 de la ley 20.417, Aysén, Bahía Anita, Centros de Engorda de Salmones (CES), Exportadora Los Fiordos Limitada, Producción, Puhuhuapi, Punta Ganso, Punta Paredes, Reclamación en contra de una resolución de la SMA, Reglamento Ambiental de Acuicultura (RAMA), Salmones, Sanción y fiscalización, Smolt, Sociedad Exportadora Los Fiordos Limitada, Tercer Tribunal Ambiental","Sala: TERCERA, CONSTITUCIONAL",Resultado recurso: SENTENCIA DE REEMPLAZO (M),Tipo recurso: (CIVIL) CASACIÓN FORMA Y FONDO,https://juris.pjud.cl/busqueda/u?dphr
Rol: 83344-2016,Caratulado: CORPORACION PARA EL DESARROLLO DE LA REGION DE LOS RIOS CON MINISTERIO DEL MEDIO AMBIENTE .,Fecha sentencia: 26-07-2017,Normas primarias o secundarias de calidad ambiental y normas de emisión,Motivación,"Falta de motivación de la decisión impugnada, Legitimación activa, Principio de imparcialidad, Ministerio del Medio Ambiente (MMA), Derecho ambiental, Anteproyecto de normas secundarias de calidad ambiental, Artículo 17 n°1 de la ley 20.600, Artículo 50 de la ley 19.300, Celulosa Arauco, Corporación Codeproval, Forestal Calle-Calle, Principios, Reclamación en contra de una norma de calidad y/o emisión, Río Valdivia","Sala: TERCERA, CONSTITUCIONAL",Resultado recurso: RECHAZA CASACION EN EL FONDO (M),Tipo recurso: (CIVIL) CASACIÓN FONDO,https://juris.pjud.cl/busqueda/u?j1io
Rol: 31176-2016,Caratulado: CORPORACION FISCALIA DEL MEDIO AMBIENTE CON DIRECTOR EJECUTIVO DEL SERVICIO DE EVALUACION AMBIENTAL. **,Fecha sentencia: 25-07-2017,Sistema de Evaluación de impacto ambiental (SEIA),Invalidación,"Principio de impugnabilidad, Sistema de evaluación de impacto ambiental, Tribunal Ambiental, Ampliación del plazo, Derecho ambiental, Artículo 17 n°8 de la ley 20.600, Corporación Fiscalía del Medio Ambiente, Director Ejecutivo del Servicio de Evaluación Ambiental (SEA), Hidroeléctrica Centinela, Hidroeléctrica El Castillo, Invalidación facultad, Invalidación impropia, Observaciones ciudadanas, Reclamación en contra de la invalidación ambiental, Tercero absoluto","Sala: TERCERA, CONSTITUCIONAL",Resultado recurso: SENTENCIA DE REEMPLAZO (M),Tipo recurso: (CIVIL) CASACIÓN FONDO,https://juris.pjud.cl/busqueda/u?g66q
Rol: 58986-2016,Caratulado: SOCIEDAD VINICOLA MIGUEL TORRES S. A. CONTRA SUPERINTENDENCIA DEL MEDIO AMBIENTE.,Fecha sentencia: 17-07-2017,Potestad sancionadora y fiscalizadora,Programa de cumplimiento,"Programa de cumplimiento, Sana crítica, Superintendencia del medio ambiente (sma), Curicó, Artículo 17 n°3 de la ley 20.600, Artículo 56 de la ley 20.417, Curtiembre Rufino Melero S.A., Ingreso al Sistema de Evaluación de Impacto Ambiental (SEIA), Proyecto complementario denominado Sistema de Neutralización y Depuración de Residuos Industriales Líquidos de Curtiembre Francisco Corta y Compañía Limitada, Proyecto Modificación del Sistema de Neutralización y Depuración de Residuos Industriales Líquidos de Curtiembre Francisco Corta y Compañía Limitada, Reclamación en contra de una resolución de la SMA, Sanción y fiscalización, Segundo Tribunal Ambiental, Sociedad Vinícola Miguel Torres S.A.","Sala: TERCERA, CONSTITUCIONAL",Resultado recurso: RECHAZADAS CASACIÓN FORMA Y FONDO (M),Tipo recurso: (CIVIL) CASACIÓN FORMA Y FONDO,https://juris.pjud.cl/busqueda/u?f3eb
Rol: 45807-2016,Caratulado: MATURANA CRINO LUIS FERNANDO CON DIRECTOR EJECUTIVO DEL SERVICIO DE EVALUACION AMBIENTAL.,Fecha sentencia: 06-07-2017,Sistema de Evaluación de impacto ambiental (SEIA),Invalidación,"Sistema de evaluación de impacto ambiental, Plazo de interposición del recurso, Ampliación del plazo, Derecho ambiental, Agrícola Sichahue Limitada, Artículo 17 n°8 de la ley 20.600, Comisión de Evaluación Ambiental de la Región de Los Ríos, Director Ejecutivo del Servicio de Evaluación Ambiental (SEA), Piscicultura, Proyecto denominado ¿Piscicultura Río Calcurrupe¿, Reclamación en contra de la invalidación ambiental, Tercero absoluto, Tercero participante","Sala: TERCERA, CONSTITUCIONAL",Resultado recurso: SENTENCIA DE REEMPLAZO (M),Tipo recurso: (CIVIL) CASACIÓN FONDO,https://juris.pjud.cl/busqueda/u?hy2i
Rol: 45807-2016,Caratulado: MATURANA CRINO LUIS FERNANDO CON DIRECTOR EJECUTIVO DEL SERVICIO DE EVALUACION AMBIENTAL.,Fecha sentencia: 06-07-2017,Sistema de Evaluación de impacto ambiental (SEIA),Invalidación,"Sistema de evaluación de impacto ambiental, Plazo de interposición del recurso, Ampliación del plazo, Derecho ambiental, Agrícola Sichahue Limitada, Artículo 17 n°8 de la ley 20.600, Comisión de Evaluación Ambiental de la Región de Los Ríos, Director Ejecutivo del Servicio de Evaluación Ambiental (SEA), Piscicultura, Proyecto denominado ¿Piscicultura Río Calcurrupe¿, Reclamación en contra de la invalidación ambiental, Tercero absoluto, Tercero participante","Sala: TERCERA, CONSTITUCIONAL","Resultado recurso: ACOGIDA CASACIÓN FONDO, ANULADA SENTENCIA DE (M)",Tipo recurso: (CIVIL) CASACIÓN FONDO,https://juris.pjud.cl/busqueda/u?hyoq
Rol: 67418-2016,Caratulado: VICTOR BARRIA OYARZO CON SUPERINTENDENCIA DEL MEDIO AMBIENTE.,Fecha sentencia: 03-07-2017,Potestad sancionadora,Legalidad,"Acto administrativo, Control judicial, Fiscalización, Ilegalidad, Normativa ambiental, Potestad sancionadora, Principio preventivo, Procedimiento administrativo sancionador, Programa de cumplimiento, Recurso de casación en el fondo, Superintendencia del medio ambiente (sma), Contaminación, Código sanitario, Derecho administrativo sancionador, Falta de integridad, Ley Organica de la Superintendencia del Medio Ambiente (SMA), Principio precautorio, Requisitos esenciales, Servicios Sanitarios de Los Lagos S.A., Tribunal Ambiental","Sala: TERCERA, CONSTITUCIONAL",Resultado recurso: RECHAZA CASACION EN EL FONDO (M),Tipo recurso: (CIVIL) CASACIÓN FONDO,https://juris.pjud.cl/busqueda/u?emdg
Rol: 47629-2016,Caratulado: COMUNIDAD MAPUCHE SUCESION QUIÑIMIL PIRUL Y OTROS CON COMISION EVALUACION AMBIENTAL VIII REGION,Fecha sentencia: 29-05-2017,Sistema de Evaluación de impacto ambiental (SEIA),Invalidación,"Consulta indígena, Ultra petita, Sistema de evaluación de impacto ambiental, Comunidades indígenas, Resolución de Calificación Ambiental (RCA), Derecho ambiental, Amicus curiae, Artículo 17 n°8 de la ley 20.600, Asociación Indígena Maulén Arauco, Comisión de Evaluación Ambiental de la Región del Biobío, Comunidades Indígenas Sucesión Quiñimil Pirul, Kudawfe Peñi, Chilcoco y Newentuain Pu Peñi, Empresa Arauco y Constitución S.A., Planta Arauco, Proyecto ""Modernización Ampliación Planta Arauco"", Reclamación en contra de la invalidación ambiental, Falta de fundamentos del recurso","Sala: TERCERA, CONSTITUCIONAL",Resultado recurso: RECHAZADAS CASACIÓN FORMA Y FONDO (M),Tipo recurso: (CIVIL) CASACIÓN FORMA Y FONDO,https://juris.pjud.cl/busqueda/u?izet
Rol: 61291-2016,Caratulado: PAMPA CAMARONES S. A. CON SUPERINTENDENCIA DEL MEDIO AMBIENTE.,Fecha sentencia: 24-04-2017,Potestad sancionadora y fiscalizadora,Medidas provisionales,"Medidas provisionales, Principio de proporcionalidad, Sana crítica, Daño futuro, Superintendencia del medio ambiente (sma), Daño ambiental, Principio precautorio, Servicio nacional de pesca (sernapesca), Derecho ambiental, Arica y Paranicota, Artículo 17 n°3 de la ley 20.600, Artículo 56 de la ley 20.417, Certeza, Cobre, Daño inminente, Pampa Camarones S.A., Plan Global de Monitoreo y Protección del Chungungo, Planta de Cátodos Pampa Camarones, Punta Madrid, Reclamación en contra de una resolución de la SMA, Riesgo ambiental, Riesgo hipotético, Sanción y fiscalización, Segundo Tribunal Ambiental, Sistema de impulsión de agua de mar (SIAM)","Sala: TERCERA, CONSTITUCIONAL",Resultado recurso: RECHAZADAS CASACIÓN FORMA Y FONDO (M),Tipo recurso: (CIVIL) CASACIÓN FORMA Y FONDO,https://juris.pjud.cl/busqueda/u?dnr0
Rol: 10242-2017,Caratulado: MINERA FLORIDA LIMITADA/ESCUDERO,Fecha sentencia: 10-04-2017,Admisibilidad del recurso de queja,Resoluciones susceptibles de recurso de queja,"Admisibilidad del recurso de queja, Resoluciones susceptibles de recurso de queja","Sala: TERCERA, CONSTITUCIONAL",Resultado recurso: INADMISIBLE RECURSO DE QUEJA,Tipo recurso: (CIVIL) QUEJA,https://juris.pjud.cl/busqueda/u?hy2j
Rol: 47890-2016,"Caratulado: JUSTO MIRANDA VERA, JUAN ANDRES MIRA MILLACHINE CON ILUSTRE MUNICIPALIDAD DE PUERTO NATALES.",Fecha sentencia: 07-03-2017,Daño ambiental,Prescripción,"Falta de servicio, Municipalidad, Prescripción, Presunción de culpa, Residuos domiciliarios, Contaminación, Daño ambiental, Derecho ambiental, Paisaje, Viento, Agravio permanente, Artículo 17 n°2 de la ley 20.600, Artículo 53 de la ley 19.300, Culpa probada, Existencia del daño, Significativo, Suelo, Vegetación, Vertedero Municipal, Bolsas plásticas, Cierre perimetral, Conducción de la escorrentía superficial, Extensión del daño, Fauna silvestre, Impermeabilización de lixiviados, Lixiviados","Sala: TERCERA, CONSTITUCIONAL",Resultado recurso: RECHAZADAS CASACIÓN FORMA Y FONDO (M),Tipo recurso: (CIVIL) CASACIÓN FONDO,https://juris.pjud.cl/busqueda/u?do8g
Rol: 27821-2016,Caratulado: IMPORTADORA Y COMERCIALIZADORA FLOKA LTDA. CON SERVICIO DE EVALUACION AMBIENTAL.,Fecha sentencia: 07-03-2017,Sistema de Evaluación de impacto ambiental (SEIA),Invalidación,"Falta de motivación de la decisión impugnada, Principio de trascendencia, Vicio esencial, Residuos domiciliarios, Vicio de ilegalidad, Resolución de Calificación Ambiental (RCA), Sistema de Evaluación de Impacto Ambiental (SEIA), Motivaciones contradictorias, Secretaría Regional Ministerial de Salud (SEREMI de Salud), Derecho ambiental, Adenda, Artículo 17 n°5 de la ley 20.600, Artículo 20 de la ley 19.300, Contigencia por malos olores, Declaración de Impacto Ambiental (DIA), Director Ejecutivo del Servicio de Evaluación Ambiental (SEA), Disposición y aprovechamiento de materiales residuales, Gases, Olores, Permiso ambiental sectorial 93 (PAS 93 ), Plan de contigencia, Principio de contradicción, Proyecto Mejoras en Planta de Valorización de Materiales, Punto focal de generación de olores, Reclamación del titular en el SEIA, Relleno sanitario, Residuales, Residuos industriales, Riesgo para la salud, Secretaría Regional Ministerial de Medio Ambiente, Sociedad Importadora y Comercializadora Floka Limitada, Valorazación de materiales residuales","Sala: TERCERA, CONSTITUCIONAL","Resultado recurso: ACOGIDA CASACIÓN FORMA, ANULADA SENTENCIA DE (M)",Tipo recurso: (CIVIL) CASACIÓN FORMA Y FONDO,https://juris.pjud.cl/busqueda/u?s17x
Rol: 97685-2016,Caratulado: COMITE PRO DEFENSA DEL PATRIMONIO HISTORICO DE VIÑA DEL MAR,Fecha sentencia: 15-12-2016,Admisibilidad del recurso de queja,Resoluciones susceptibles de recurso de queja,"Admisibilidad del recurso de queja, Fianza de resultas, Resoluciones susceptibles de recurso de queja, Suspensión de efectos","Sala: TERCERA, CONSTITUCIONAL",Resultado recurso: INADMISIBLE RECURSO DE QUEJA (M),Tipo recurso: (CIVIL) QUEJA,https://juris.pjud.cl/busqueda/u?hy2k
