Rol,Caratulado,Fecha Sentencia,Materia,Submateria,Descriptores,Sala,Resultado Recurso,Tipo Recurso,Enlace Sentencia
Rol: 4222-2021,Caratulado: CORPORACIÓN PRIVADA PARA EL DESARROLLO DE AYSÉN CON DIRECTOR EJECUTIVO DEL SERVICIO DE EVALUACIÓN AMBIENTAL(A)*,Fecha sentencia: 09-08-2021,Admisibilidad del recurso de casación en el fondo,Resoluciones susceptibles de casación en el fondo,"Servicio de evaluación ambiental (SEA), Solicitud de invalidación, Admisibilidad del recurso de casación en el fondo, Sentencia definitiva, Inadmisibilidad del recurso de casación en el fondo, Naturaleza jurídica de la resolución impugnada, Declaración de Impacto Ambiental (DIA), Invalidación impropia, Participación ciudadana, Resoluciones susceptibles de recurso de casación en el fondo, Reclamación en contra de una invalidación ambiental","Sala: TERCERA, CONSTITUCIONAL",Resultado recurso: INADMISIBLE CASACIÓN DE FONDO (M),Tipo recurso: (CIVIL) CASACIÓN AMBIENTAL,https://juris.pjud.cl/busqueda/u?emsf
Rol: 3647-2019,Caratulado: HECTOR RUBEN SANHUEZA Y OTRO CON COLBÚN S.A. **(A),Fecha sentencia: 03-08-2021,Daño ambiental,Reparación,"Principio preventivo, Presunción de culpa, Ausencia de error de derecho, Daño ambiental, No se denuncia infracción a la norma decisoria litis, Central Termoeléctrica Santa María, Componente ambiental afectado, Reparación del daño, Evaluación de Impacto Ambiental, Componente aire, Componente agua, Colbún Transmisión S.A., Ausencia de vulneración a reglas de la sana crítica","Sala: TERCERA, CONSTITUCIONAL",Resultado recurso: RECHAZADAS CASACIÓN FORMA Y FONDO (M),Tipo recurso: (CIVIL) CASACIÓN FORMA Y FONDO,https://juris.pjud.cl/busqueda/u?dvpm
Rol: 6960-2021,Caratulado: AGUIRRE/MINISTERIO DEL MEDIO AMBIENTE,Fecha sentencia: 02-08-2021,Admisibilidad del recurso de casación en el fondo,Manifiesta falta de fundamentos,"Manifiesta falta de fundamento, Solicitud de invalidación, Inundación, Falta de fundamentación del acto administrativo, Ministerio del Medio Ambiente (MMA), Falta de competencia, Corporación Nacional Forestal (CONAF), Zona de protección, Alegaciones nuevas, Santuario de la Naturaleza Carlos Andwandter, Isla, Infracción de normas reguladoras de la prueba, Reclamación en contra de una invalidación ambiental, Cartografía","Sala: TERCERA, CONSTITUCIONAL",Resultado recurso: RECHAZA CASACION EN EL FONDO,Tipo recurso: (CIVIL) CASACIÓN AMBIENTAL,https://juris.pjud.cl/busqueda/u?dfwq
Rol: 43698-2020,Caratulado: CHADWICK DITTBORN ARTURO CON CON SERVICIO DE EVALUACION AMBIENTAL. (A),Fecha sentencia: 28-07-2021,Sistema de Evaluación de impacto ambiental (SEIA),Invalidación,"Legitimación activa, Principio de impugnabilidad, Servicio de Evaluación Ambiental, Acumulación de autos, Agotamiento de la vía administrativa, Resolución de Calificación Ambiental (RCA), Sistema de Evaluación de Impacto Ambiental (SEIA), Resoluciones contradictorias, Comité de Ministros, Reclamación en contra de una invalidación ambiental","Sala: TERCERA, CONSTITUCIONAL",Resultado recurso: SENTENCIA DE REEMPLAZO,Tipo recurso: (CIVIL) CASACIÓN AMBIENTAL,https://juris.pjud.cl/busqueda/u?e6es
Rol: 29065-2019,Caratulado: MORENO ROZAS HUGO Y OTRO CON DIRECTOR EJECUTIVO DEL SERVICIO DE EVALUACION AMBIENTAL (RELATOR: SR.DANILO QUEZADA),Fecha sentencia: 21-07-2021,Sistema de Evaluación de impacto ambiental (SEIA),Participación ciudadana/consulta indígena,"Derecho a vivir en un medio ambiente libre de contaminación, Normas reguladoras de la prueba, Principio de participación ciudadana, Servicio de Evaluación Ambiental, Sistema de Evaluación de Impacto Ambiental (SEIA), Comité de Ministros, Fraccionamiento de proyecto, Obstrucción o restricción a la libre circulación, conectividad o el aumento significativo de los tiempos de desplazamiento, Participación ciudadana, Reclamación de participación ciudadana en el SEIA, Residuos industriales, Principio de cooperación, Calidad de vida, Hechos establecidos por los jueces del fondo son inamovibles, Comunidades o grupos humanos, No denuncia el quebrantamiento o desatención de concreta regla de la sana crítica","Sala: TERCERA, CONSTITUCIONAL",Resultado recurso: RECHAZADAS CASACIÓN FORMA Y FONDO,Tipo recurso: (CIVIL) CASACIÓN FORMA Y FONDO,https://juris.pjud.cl/busqueda/u?di1c
Rol: 29065-2019,Caratulado: MORENO ROZAS HUGO Y OTRO CON DIRECTOR EJECUTIVO DEL SERVICIO DE EVALUACION AMBIENTAL (RELATOR: SR.DANILO QUEZADA),Fecha sentencia: 21-07-2021,Sistema de Evaluación de impacto ambiental (SEIA),Participación ciudadana/consulta indígena,"Competencia, Servicio de Evaluación Ambiental, Resolución de Calificación Ambiental (RCA), Comisión de Evaluación Ambiental de la Región Metropolitana, Participación ciudadana, Reclamación de participación ciudadana en el SEIA","Sala: TERCERA, CONSTITUCIONAL",Resultado recurso: SENTENCIA DE REEMPLAZO,Tipo recurso: (CIVIL) CASACIÓN FORMA Y FONDO,https://juris.pjud.cl/busqueda/u?dphu
Rol: 14075-2021,Caratulado: DIRECTOR EJECUTIVO DEL SERVICIO DE EVALUACIÓN AMBIENTAL/COMUNIDAD INDÍGENA ATAP,Fecha sentencia: 14-07-2021,Admisibilidad del recurso de casación en el fondo,Manifiesta falta de fundamentos,"Evaluación ambiental, Manifiesta falta de fundamento, Recurso de reclamación, Sana crítica, Ultra petita, Admisibilidad del recurso de casación en el fondo, Invalidación administrativa, Admisibilidad del recurso de casación en la forma, Evaluación deficiente, Comunidades indígenas, Falta de información, Área de influencia, Concesión acuícola, Declaración de Impacto Ambiental (DIA), Director Ejecutivo del Servicio de Evaluación Ambiental (SEA), Informe Consolidado de Aclaraciones, Rectificaciones y Ampliaciones (ICSARA), Reclamación en contra de la invalidación ambiental, Tercero absoluto, Efecto adverso significativo, Comisión de Evaluación Ambiental de la región de Magallanes y Antártica Chilena, Biota marina, Acto administrativo de carácter ambiental, Impacto significativo, Centro de cultivo de salmónidos, Titular de proyecto ambiental entrega información insuficiente, Seno taraba","Sala: TERCERA, CONSTITUCIONAL","Resultado recurso: INADMISIBLE CASACIÓN FORMA RECHAZADA,CASACIÓN F(M)",Tipo recurso: (CIVIL) CASACIÓN AMBIENTAL,https://juris.pjud.cl/busqueda/u?egxj
Rol: 99487-2020,Caratulado: AGRÍCOLA SANTIS FRUT LIMITADA CON SUPERINTENDENCIA DEL MEDIO AMBIENTE (A),Fecha sentencia: 22-06-2021,Potestad sancionadora y fiscalizadora,Multa,"Infracción permanente, Multa, Levantamiento del velo corporativo, Proporcionalidad de la sanción, Procedencia excepción de prescripción, Reclamación en contra de una resolución de la SMA, Potestad sancionadora y fiscalizadora, Revocación de la Resolución de Calificación Ambiental, Infracción a la sana crítica, Vicios de congruencia, Sociedades relacionadas, Disconformidad con la valoración de la prueba","Sala: TERCERA, CONSTITUCIONAL",Resultado recurso: RECHAZADAS CASACIÓN FORMA Y FONDO,Tipo recurso: (CIVIL) CASACIÓN AMBIENTAL,https://juris.pjud.cl/busqueda/u?dkzv
Rol: 3993-2021,Caratulado: OSORIO/QUEIROLO,Fecha sentencia: 17-05-2021,Admisibilidad del recurso de queja,Resoluciones susceptibles de recurso de queja,"Admisibilidad del recurso de queja, Interés actual, Tercero coadyuvante, Actuación de oficio de la Corte Suprema, Error de procedimiento, Calidad de interesado","Sala: TERCERA, CONSTITUCIONAL",Resultado recurso: INADMISIBLE RECURSO DE QUEJA,Tipo recurso: (CIVIL) QUEJA,https://juris.pjud.cl/busqueda/u?hyln
Rol: 36277-2019,Caratulado: MUNICIPALIDAD DE SAN FELIPE CON SERVICIO DE EVALUACION AMBIENTAL (A),Fecha sentencia: 10-05-2021,Sistema de Evaluación de impacto ambiental (SEIA),Resolución de calificación ambiental (rca),"Cosa juzgada, Normas reguladoras de la prueba, Principio de juridicidad, Falta de motivación del acto administrativo, Actividad económica, Resolución de Calificación Ambiental (RCA), Sistema de Evaluación de Impacto Ambiental (SEIA), Calidad de interesado, Acción de reclamación, Área protegida, Humedal, Ilustre Municipalidad de San Felipe, Planificación territorial, Preservación de la naturaleza, Procedimiento ambiental, Proyecto fotovoltaico","Sala: TERCERA, CONSTITUCIONAL",Resultado recurso: RECHAZA CASACION EN EL FONDO,Tipo recurso: (CIVIL) CASACIÓN FONDO,https://juris.pjud.cl/busqueda/u?dxhx
Rol: 79353-2020,Caratulado: FUENZALIDA MOURE Y COMPAÑIA LIMITADAS LTDA./SUPERINTENDENCIA DEL MEDIO AMBIENTE,Fecha sentencia: 26-04-2021,Admisibilidad del recurso de casación en el fondo,Manifiesta falta de fundamentos,"Derecho a la defensa, Manifiesta falta de fundamento, Principio de proporcionalidad, Principio de publicidad, Principio de transparencia, Razonabilidad, Admisibilidad del recurso de casación en el fondo, Control jurisdiccional, Superintendencia del medio ambiente (sma), Facultad discrecional, Deber de fundamentación, Malos olores, Sanción de multa, Potestad sancionadora y fiscalizadora, Falta de titularidad, Ausencia de influencia sustancial en lo dispositivo del fallo, Avícola, Reclamo en contra de una resolución de la sma, No se verifica error de derecho denunciado","Sala: TERCERA, CONSTITUCIONAL",Resultado recurso: RECHAZA CASACION EN EL FONDO,Tipo recurso: (CIVIL) CASACIÓN AMBIENTAL,https://juris.pjud.cl/busqueda/u?dxan
Rol: 59656-2020,Caratulado: QUIRQUITRIPAY ANTIMAN ELSA DELCARMEN CON FISCO DE CHILE - CONSEJO DE DEFENSA DEL ESTADO (A),Fecha sentencia: 21-04-2021,Sistema de Evaluación de impacto ambiental (SEIA),Invalidación,"Rechazo de solicitud, Reclamo de ilegalidad, Recurso de reclamación, Comunidad indígena, Naturaleza jurídica de la resolución impugnada, Competencia del Tribunal Ambiental, Invalidación facultad, Invalidación impropia, Plazo para recurrir, Secretaría Regional Ministerial de Salud de la Araucanía, Falta de acción, Terceros ajenos al procedimiento, Invalidación, Proyecto escombrera, sitio de disposición de residuos no peligrosos","Sala: TERCERA, CONSTITUCIONAL",Resultado recurso: RECHAZA CASACION EN EL FONDO,Tipo recurso: (CIVIL) CASACIÓN AMBIENTAL,https://juris.pjud.cl/busqueda/u?c5rg
Rol: 131598-2020,Caratulado: LETELIER/QUEIROLO,Fecha sentencia: 29-03-2021,Admisibilidad del recurso de queja,Resoluciones susceptibles de recurso de queja,"Admisibilidad del recurso de queja, Requisitos formales del recurso de casación en el fondo, Examen de admisibilidad del recurso de casación en el fondo, Recurso interpuesto dentro de plazo, Competencia de la Corte Suprema, Actuación de oficio de la Corte Suprema, Resoluciones susceptibles del recurso de queja, Inadmisible recurso de casación en el fondo","Sala: TERCERA, CONSTITUCIONAL",Resultado recurso: INADMISIBLE RECURSO DE QUEJA,Tipo recurso: (CIVIL) QUEJA,https://juris.pjud.cl/busqueda/u?hylo
Rol: 117379-2020,Caratulado: LEÓN/SUPERINTENDENCIA DEL MEDIO AMBIENTE,Fecha sentencia: 08-02-2021,Admisibilidad del recurso de casación en el fondo,Manifiesta falta de fundamentos,"Manifiesta falta de fundamento, Programa de cumplimiento, Admisibilidad del recurso de casación en el fondo, Sentencia definitiva, Admisibilidad del recurso de casación en la forma, Corporación Nacional del Cobre de Chile (CODELCO), No se denuncia infracción a las normas reguladoras de la prueba, Improcedencia del recurso de casación, Reclamación en contra de una resolución de la SMA, Segundo Tribunal Ambiental","Sala: TERCERA, CONSTITUCIONAL",Resultado recurso: INADMISIBLE CASACIÓN FORMA Y FONDO,Tipo recurso: (CIVIL) CASACIÓN AMBIENTAL,https://juris.pjud.cl/busqueda/u?gf1s
Rol: 72108-2020,Caratulado: ILUSTRE MUNICIPALIDAD DE CALDERA Y OTROS/SERVICIO DE EVALUACION AMBIENTAL,Fecha sentencia: 08-02-2021,Sistema de Evaluación de impacto ambiental (SEIA),Participación ciudadana/consulta indígena,"Legitimación activa, Municipalidades, Derecho ambiental, Observaciones ciudadanas, Reclamación de participación ciudadana en el SEIA","Sala: TERCERA, CONSTITUCIONAL",Resultado recurso: RECHAZA CASACION EN EL FONDO,Tipo recurso: (CIVIL) CASACIÓN AMBIENTAL,https://juris.pjud.cl/busqueda/u?hcpd
Rol: 22026-2019,Caratulado: CECILIA AGUERO RAMIREZ Y OTROS CON COMISION DE EVALUACION AMBIENTAL LOS RIOS (A),Fecha sentencia: 27-01-2021,Admisibilidad del recurso de casación en el fondo,Resoluciones susceptibles de casación en el fondo,"Bien nacional de uso público, Principio de coordinación, Principio de participación ciudadana, Reglas de la sana crítica, Valoración de la prueba, Principio de razón suficiente, Admisibilidad del recurso de casación en el fondo, Falta de legitimación activa, Admisibilidad del recurso de casación en la forma, Resoluciones susceptibles de recurso de casación en la forma, Ingreso al Sistema de Evaluación de Impacto Ambiental (SEIA), Resoluciones susceptibles de recurso de casación en el fondo, Reclamo contra resolución administrativa, Construcción de estacionamientos subterráneos","Sala: TERCERA, CONSTITUCIONAL",Resultado recurso: INADMISIBLES RECURSOS DE CASACIÓN FORMA Y FONDO(M),Tipo recurso: (CIVIL) CASACIÓN FORMA Y FONDO,https://juris.pjud.cl/busqueda/u?sccs
Rol: 2675-2020,Caratulado: MONSALVES FUENTES LUIS ALONSO CON CELULOSA ARAUCO Y CONSTITUCION S.A. **,Fecha sentencia: 26-01-2021,Daño ambiental,Existencia del daño,"Sana crítica, Falta de legitimación activa, Falta de legitimación pasiva, Daño ambiental, Falta de prueba, Emisiones a la atmósfera, Descarga de riles, Artículo 17 n°2 de la ley 20.600, Artículo 53 de la ley 19.300, Existencia del daño, Presunción de responsabilidad","Sala: TERCERA, CONSTITUCIONAL",Resultado recurso: RECHAZADAS CASACIÓN FORMA Y FONDO (M),Tipo recurso: (CIVIL) CASACIÓN AMBIENTAL,https://juris.pjud.cl/busqueda/u?folr
Rol: 11558-2019,Caratulado: SINDICATO DE TRABAJADORES INDEPENDIENTES DE PESCADORES ARTESANALES MERLUCEROS Y AFINES CALETA LO ROJAS DE CORONEL Y OTROS CON CELULOSA ARAUCO Y CONSTITUCION S.A. PLANTA HORCONES S.A. (A) **,Fecha sentencia: 26-01-2021,Daño ambiental,Existencia del daño,"Sana crítica, Falta de legitimación activa, Falta de legitimación pasiva, Daño ambiental, Malos olores, Derrame, Recursos hidrobiológicos, Falta de prueba, Derecho ambiental, Emisiones a la atmósfera, Especies hidrobiológicas, Descarga de riles, Artículo 17 n°2 de la ley 20.600, Artículo 53 de la ley 19.300, Existencia del daño, Presunción de responsabilidad","Sala: TERCERA, CONSTITUCIONAL",Resultado recurso: RECHAZADAS CASACIÓN FORMA Y FONDO (M),Tipo recurso: (CIVIL) CASACIÓN FORMA Y FONDO,https://juris.pjud.cl/busqueda/u?folq
Rol: 8573-2019,Caratulado: JARA ALARCON LUIS CON SERVICIO DE EVALUACION AMBIENTAL (A),Fecha sentencia: 13-01-2021,Sistema de Evaluación de impacto ambiental (SEIA),Participación ciudadana/consulta indígena,"Consulta indígena, Comité de Ministros, Derecho ambiental, Participación ciudadana, Reclamación de participación ciudadana en el SEIA","Sala: TERCERA, CONSTITUCIONAL",Resultado recurso: SENTENCIA DE REEMPLAZO (M),Tipo recurso: (CIVIL) CASACIÓN FORMA Y FONDO,https://juris.pjud.cl/busqueda/u?hylp
Rol: 8573-2019,Caratulado: JARA ALARCON LUIS CON SERVICIO DE EVALUACION AMBIENTAL (A),Fecha sentencia: 13-01-2021,Sistema de Evaluación de impacto ambiental (SEIA),Participación ciudadana/consulta indígena,"Consulta indígena, Principio de participación ciudadana, Derecho ambiental, Reclamación de participación ciudadana en el SEIA, Agua subterránea","Sala: TERCERA, CONSTITUCIONAL","Resultado recurso: ACOGIDA CASACIÓN FONDO, ANULADA SENTENCIA DE (M)",Tipo recurso: (CIVIL) CASACIÓN FORMA Y FONDO,https://juris.pjud.cl/busqueda/u?dac0
Rol: 43799-2020,Caratulado: SERVICIO DE EVALUACION AMBIENTAL CON IBBA (A),Fecha sentencia: 28-12-2020,Sistema de Evaluación de impacto ambiental (SEIA),Consulta de pertinencia,"Potestad invalidatoria, Revisión de oficio, Derecho ambiental, Consulta de pertinencia, Reclamación en contra de una invalidación ambiental","Sala: TERCERA, CONSTITUCIONAL",Resultado recurso: RECHAZA CASACION EN EL FONDO,Tipo recurso: (CIVIL) CASACIÓN AMBIENTAL,https://juris.pjud.cl/busqueda/u?fdwx
Rol: 59503-2020,Caratulado: ESPINOZA/EMPRESA ELECTRICA CAREN S.A,Fecha sentencia: 11-12-2020,Admisibilidad del recurso de casación en el fondo,Manifiesta falta de fundamentos,"Manifiesta falta de fundamento, Admisibilidad del recurso de casación en el fondo, Central Hidroeléctrica, Admisibilidad del recurso de casación en la forma, Daño ambiental, Obras hidráulicas, Falta de prueba, Derecho ambiental, Características del daño, Existencia del daño, Presunción de responsabilidad, Cauce de río, Erosión del suelo, Daño ambiental no significativo, Causales del recurso de casación en la forma","Sala: TERCERA, CONSTITUCIONAL",Resultado recurso: INADMISIBLE CASACIÓN FORMA; RECHAZA CASACIÓN EN EL FONDO,Tipo recurso: (CIVIL) CASACIÓN AMBIENTAL,https://juris.pjud.cl/busqueda/u?een4
Rol: 50346-2020,Caratulado: LABRÍN/FISCO DE CHILE (MOP),Fecha sentencia: 17-11-2020,Admisibilidad del recurso de casación en el fondo,Manifiesta falta de fundamentos,"Manifiesta falta de fundamento, Normas reguladoras de la prueba, Recurso de casación en el fondo, Sana crítica, Examen de admisibilidad del recurso de casación en la forma, Daño ambiental, Falta de prueba, Derecho ambiental, Competencia del Tribunal Ambiental","Sala: TERCERA, CONSTITUCIONAL","Resultado recurso: INADMISIBLE CASACIÓN FORMA, RECHAZADA CASACIÓN FONDO",Tipo recurso: (CIVIL) CASACIÓN AMBIENTAL,https://juris.pjud.cl/busqueda/u?deam
Rol: 29062-2019,Caratulado: INMOBILIARIA TORO MAZZOTE CON SUPERINTENDENCIA DEL MEDIO AMBIENTE (A),Fecha sentencia: 03-11-2020,Potestad sancionadora y fiscalizadora,Multa,"Reglas de la sana crítica, Superintendencia del medio ambiente (sma), Derecho ambiental, Elusión del Sistema de Evaluación de Impacto Ambiental, Inicio de ejecución","Sala: TERCERA, CONSTITUCIONAL",Resultado recurso: RECHAZADAS CASACIÓN FORMA Y FONDO,Tipo recurso: (CIVIL) CASACIÓN FORMA Y FONDO,https://juris.pjud.cl/busqueda/u?dogi
Rol: 24001-2019,Caratulado: ADOLFO DEL TRANSITO BARRAZA Y OTROS CON SERVICIO DE EVALUACION AMBIENTAL (A),Fecha sentencia: 19-10-2020,Admisibilidad del recurso de casación en el fondo,Resoluciones susceptibles de casación en el fondo,"Examen de admisibilidad del recurso de casación en el fondo, Examen de admisibilidad del recurso de casación en la forma, Central Hidroeléctrica, Falta de legitimación activa, Derecho ambiental, Invalidación de resolución de calificación ambiental, Invalidación impropia, Tercero absoluto, Inadmisibilidad casación, Resolución no susceptible de recurso de casación en la forma, Resolución no susceptible de recurso de casación en el fondo","Sala: TERCERA, CONSTITUCIONAL",Resultado recurso: INADMISIBLES RECURSOS DE CASACIÓN FORMA Y FONDO,Tipo recurso: (CIVIL) CASACIÓN FORMA Y FONDO,https://juris.pjud.cl/busqueda/u?g66n
Rol: 43798-2020,Caratulado: SUPERINTENDENCIA DEL MEDIO AMBIENTE/VELÁSQUEZ,Fecha sentencia: 14-10-2020,Admisibilidad del recurso de casación en el fondo,Resoluciones susceptibles de casación en el fondo,"Formulación de cargos, Examen de admisibilidad del recurso de casación en el fondo, Examen de admisibilidad del recurso de casación en la forma, Falta de decisión del asunto controvertido, Naturaleza jurídica de la resolución impugnada, Derecho ambiental, Inadmisibilidad casación, Resolución no susceptible de recurso de casación en la forma, Procedimiento adminsitrativo sancionatorio, Competencia superintendencia de medio ambiente (sma), Resolución no susceptible de recurso de casación en el fondo","Sala: TERCERA, CONSTITUCIONAL",Resultado recurso: INADMISIBLES RECURSOS DE CASACIÓN FORMA Y FONDO,Tipo recurso: (CIVIL) CASACIÓN AMBIENTAL,https://juris.pjud.cl/busqueda/u?dxw0
Rol: 7785-2019,Caratulado: ALDUNATE HERRERA OSCAR ARMANDO Y OTRO CON DIRECTOR EJECUTIVO DEL SERVICIO DE EVALUACION AMBIENTAL (A),Fecha sentencia: 07-08-2020,Sistema de Evaluación de impacto ambiental (SEIA),Invalidación,"Procedimiento administrativo, Acto intermedio o de trámite, Sistema de Evaluación de Impacto Ambiental (SEIA), Reclamación en contra de sanción Comisión de Evaluación Ambiental o Director Ejecutivo, Revisión de la Resolución de calificación ambiental (RCA), Improcedencia de recursos, Invalidación","Sala: TERCERA, CONSTITUCIONAL",Resultado recurso: RECHAZADAS CASACIÓN FORMA Y FONDO,Tipo recurso: (CIVIL) CASACIÓN FORMA Y FONDO,https://juris.pjud.cl/busqueda/u?hyls
Rol: 20909-2020,Caratulado: CORPORACIÓN PRIVADA PARA EL DESARROLLO DE AYSÉN/SERVICIO DE EVALUACION AMBIENTAL ARAUCANIA,Fecha sentencia: 28-07-2020,Admisibilidad del recurso de casación en el fondo,Manifiesta falta de fundamentos,"Congruencia, Manifiesta falta de fundamento, Recurso de protección, Sana crítica, Ultra petita, Admisibilidad del recurso de casación en la forma, Tercero coadyuvante, Hechos no configuran la causal invocada, Rechazo por manifiesta falta de fundamento, Sistema de Evaluación de Impacto Ambiental (SEIA), Laguna Salitrosa, Sitio priotario, Inexistencia de vulneración a las normas reguladoras de la prueba, Infracción a la sana crítica, Reclamación en contra de una invalidación ambiental, Disconformidad con la valoración de la prueba, Falta de congruencia, Real academia de la lengua española (rae), Invalidación, Recurso denuncia infracción de norma reglamentaria, Procedimiento de evaluación de impacto ambiental retrotraído","Sala: TERCERA, CONSTITUCIONAL",Resultado recurso: INADMISIBLE CASACIÓN FORMA; RECHAZA CASACIÓN FONDO,Tipo recurso: (CIVIL) CASACIÓN AMBIENTAL,https://juris.pjud.cl/busqueda/u?c8t9
Rol: 29521-2019,Caratulado: JUNTA DE VECINOS UNION DE LAS PALMAS CON SERVICIO EVALUACION AMBIENTAL,Fecha sentencia: 22-07-2020,Sistema de Evaluación de impacto ambiental (SEIA),Invalidación,"Expropiación, Presunción de legalidad, Proceso de licitación, Condena en costas, Sistema de Evaluación de Impacto Ambiental (SEIA), Ministro de Obras Públicas (MOP), Hechos establecidos por los jueces del fondo son inamovibles, Superintendencia del Medio Ambiente, Reclamo contra resolución administrativa, Inicio de ejecución, Caducidad del proyecto, Plan de desarrollo social","Sala: TERCERA, CONSTITUCIONAL",Resultado recurso: RECHAZA CASACION EN EL FONDO,Tipo recurso: (CIVIL) CASACIÓN FONDO,https://juris.pjud.cl/busqueda/u?gori
Rol: 10300-2019,Caratulado: HIDROELECTRICA ROBLERIA SPA (HR) CON SUPERINTENDENCIA DE MEDIO AMBIENTE (A),Fecha sentencia: 30-06-2020,Nulidad procesal,De oficio,"Acto administrativo, Medidas cautelares, Reclamo de ilegalidad, Servicio de evaluación ambiental (SEA), Plazo de caducidad, Central Hidroeléctrica, Superintendencia del medio ambiente (sma), Ingreso al Sistema de Impacto Ambiental (SEIA), Nulidad procesal de oficio, Superintendencia del Medio Ambiente, Construcción de acueducto, Medida provisional","Sala: TERCERA, CONSTITUCIONAL",Resultado recurso: INVALIDADA DE OFICIO,Tipo recurso: (CIVIL) CASACIÓN FORMA Y FONDO,https://juris.pjud.cl/busqueda/u?ex2d
Rol: 28886-2019,Caratulado: COMUNIDAD INDIGENA MAPUCHE HUILICHE WEICHAN MAPU CON DIRECTOR EJECUTIVO DEL SERVICIO DE EVALUACION AMBIENTAL,Fecha sentencia: 19-06-2020,Admisibilidad del recurso de casación en el fondo,Resoluciones susceptibles de casación en el fondo,"Consulta indígena, Legitimación activa, Servicio de evaluación ambiental (SEA), Comunidad indígena, Admisibilidad del recurso de casación en el fondo, Admisibilidad del recurso de casación en la forma, Decisión del asunto controvertido, Agotamiento de la vía administrativa, Procedimiento de participación ciudadana, Reclamación ante Tribunal Ambiental, Parque eólico, Resoluciones susceptibles de recurso de casación en el fondo, Causal improcedente en juicio regido por leyes especiales","Sala: TERCERA, CONSTITUCIONAL",Resultado recurso: INADMISIBLES RECURSOS DE CASACIÓN FORMA Y FONDO,Tipo recurso: (CIVIL) CASACIÓN FORMA Y FONDO,https://juris.pjud.cl/busqueda/u?ig9q
Rol: 28195-2018,Caratulado: COMUNIDAD INDIGENA ATACAMEÑA DE SAN FRANCISCO DE CHIU CHIU CON COMITE DE MINISTROS. (A),Fecha sentencia: 16-06-2020,Sistema de Evaluación de impacto ambiental (SEIA),Participación ciudadana/consulta indígena,"Observaciones, Principio de conservación, Principio de legalidad, Comunidad indígena, Sistema de evaluación de impacto ambiental, Corporación Nacional de Desarrollo Indígena (CONADI), Servicio de Evaluación Ambiental, Resolución de Calificación Ambiental (RCA), Comité de Ministros, Consejo de Monumentos Nacionales (CMN), Artículo 17 n°6 de la ley 20.600, Estudio de impacto ambiental (EIA), Comunidad Atacameña, Adendas, Área de desarrollo Indígena, Director ejecutivo, Fracking, Informe consolidado de solicitudes de aclaraciones, rectificaciones y/o ampliaciones de la autoridad (icsara), Laguna Legal, Línea de Base de Salud, Medidas de mitigación y compensación, Mina a tajo abierto, Paisaje de Turismo, Participación Ambiental Ciudadana (PAC), Plan de manejo arqueológico, Proceso de Consulta Indígena (PCI), No indica forma en que se infringen las normas","Sala: TERCERA, CONSTITUCIONAL",Resultado recurso: RECHAZA CASACION EN EL FONDO,Tipo recurso: (CIVIL) CASACIÓN FONDO,https://juris.pjud.cl/busqueda/u?dac1
